{
  "manifestVersion": 1,
  "generatedAt": "2026-05-27T03:15:45.983220+00:00",
  "repository": "ksteffe/after-certainty",
  "ref": "main",
  "releaseTag": "latest",
  "books": [
    {
      "slug": "after-certainty",
      "source": "books",
      "status": "published",
      "title": "After Certainty",
      "subtitle": "How to Live and Judge When Understanding is not Enough",
      "description": "Expanded essay edition (~11\u201313k words)\u2014a concentrated capstone on how to live and judge after frameworks fail. Read after diagnostic volumes; formation and care without guarantees.",
      "authors": [
        "Kevin Steffensen"
      ],
      "year": 2026,
      "coverImage": "https://raw.githubusercontent.com/ksteffe/after-certainty/main/books/after-certainty/book-cover.png",
      "coverImagePath": "books/after-certainty/book-cover.png",
      "openGraphImage": "https://raw.githubusercontent.com/ksteffe/after-certainty/main/books/after-certainty/open-graph.png",
      "openGraphImagePath": "books/after-certainty/open-graph.png",
      "bookDir": "books/after-certainty",
      "docx": {
        "enabled": true,
        "file": "after-certainty.docx",
        "url": "https://github.com/ksteffe/after-certainty/releases/download/latest/after-certainty.docx"
      },
      "epub": {
        "enabled": true,
        "file": "after-certainty.epub",
        "url": "https://github.com/ksteffe/after-certainty/releases/download/latest/after-certainty.epub"
      },
      "pdf": {
        "enabled": true,
        "file": "after-certainty.pdf",
        "url": "https://github.com/ksteffe/after-certainty/releases/download/latest/after-certainty.pdf"
      }
    },
    {
      "slug": "before-certainty-arrives",
      "source": "books",
      "status": "published",
      "title": "Before Certainty Arrives",
      "subtitle": "How Moral Order Forms, Hardens, and Outlives Its Reasons",
      "description": "Essay edition\u2014moral order before certainty felt excessive. A historical prequel; stops before prescription.",
      "authors": [
        "Kevin Steffensen"
      ],
      "year": 2026,
      "coverImage": "https://raw.githubusercontent.com/ksteffe/after-certainty/main/books/before-certainty-arrives/book-cover.png",
      "coverImagePath": "books/before-certainty-arrives/book-cover.png",
      "openGraphImage": "https://raw.githubusercontent.com/ksteffe/after-certainty/main/books/before-certainty-arrives/open-graph.png",
      "openGraphImagePath": "books/before-certainty-arrives/open-graph.png",
      "bookDir": "books/before-certainty-arrives",
      "docx": {
        "enabled": true,
        "file": "before-certainty-arrives.docx",
        "url": "https://github.com/ksteffe/after-certainty/releases/download/latest/before-certainty-arrives.docx"
      },
      "epub": {
        "enabled": true,
        "file": "before-certainty-arrives.epub",
        "url": "https://github.com/ksteffe/after-certainty/releases/download/latest/before-certainty-arrives.epub"
      },
      "pdf": {
        "enabled": true,
        "file": "before-certainty-arrives.pdf",
        "url": "https://github.com/ksteffe/after-certainty/releases/download/latest/before-certainty-arrives.pdf"
      }
    },
    {
      "slug": "boundary-conditions",
      "source": "books",
      "status": "published",
      "title": "Boundary Conditions",
      "subtitle": "A Literary Organizational Fiction Novel",
      "description": "Organizational fiction about invisible coordination work, authorization boundaries, and the cost of becoming indispensable inside complex systems.",
      "authors": [
        "Kevin Steffensen"
      ],
      "year": 2026,
      "coverImage": "https://raw.githubusercontent.com/ksteffe/after-certainty/main/books/boundary-conditions/book-cover.png",
      "coverImagePath": "books/boundary-conditions/book-cover.png",
      "openGraphImage": "https://raw.githubusercontent.com/ksteffe/after-certainty/main/books/boundary-conditions/open-graph.png",
      "openGraphImagePath": "books/boundary-conditions/open-graph.png",
      "bookDir": "books/boundary-conditions",
      "docx": {
        "enabled": true,
        "file": "boundary-conditions.docx",
        "url": "https://github.com/ksteffe/after-certainty/releases/download/latest/boundary-conditions.docx"
      },
      "epub": {
        "enabled": true,
        "file": "boundary-conditions.epub",
        "url": "https://github.com/ksteffe/after-certainty/releases/download/latest/boundary-conditions.epub"
      },
      "pdf": {
        "enabled": true,
        "file": "boundary-conditions.pdf",
        "url": "https://github.com/ksteffe/after-certainty/releases/download/latest/boundary-conditions.pdf"
      }
    },
    {
      "slug": "coupling",
      "source": "books",
      "status": "published",
      "title": "Coupling",
      "subtitle": "Cohesion, Consequence, and the Architecture of Responsibility",
      "description": "A practical framework for seeing where systems are tightly joined, where they drift apart, and how those coupling choices shape accountability over time.",
      "authors": [
        "Kevin Steffensen"
      ],
      "year": 2026,
      "coverImage": "https://raw.githubusercontent.com/ksteffe/after-certainty/main/books/coupling/BookCover.png",
      "coverImagePath": "books/coupling/BookCover.png",
      "openGraphImage": "https://raw.githubusercontent.com/ksteffe/after-certainty/main/books/coupling/open-graph.png",
      "openGraphImagePath": "books/coupling/open-graph.png",
      "bookDir": "books/coupling",
      "docx": {
        "enabled": true,
        "file": "coupling.docx",
        "url": "https://github.com/ksteffe/after-certainty/releases/download/latest/coupling.docx"
      },
      "epub": {
        "enabled": true,
        "file": "coupling.epub",
        "url": "https://github.com/ksteffe/after-certainty/releases/download/latest/coupling.epub"
      },
      "pdf": {
        "enabled": true,
        "file": "coupling.pdf",
        "url": "https://github.com/ksteffe/after-certainty/releases/download/latest/coupling.pdf"
      }
    },
    {
      "slug": "curiosity-before-certainty",
      "source": "books",
      "status": "published",
      "title": "Curiosity Before Certainty",
      "subtitle": "How Curiosity Helps Us Understand a Complex World",
      "description": "An argument for disciplined curiosity as a leadership and learning posture when easy certainty hides complexity and weakens judgment.",
      "authors": [
        "Kevin Steffensen"
      ],
      "year": 2026,
      "coverImage": "https://raw.githubusercontent.com/ksteffe/after-certainty/main/books/curiosity-before-certainty/book-cover.png",
      "coverImagePath": "books/curiosity-before-certainty/book-cover.png",
      "openGraphImage": "https://raw.githubusercontent.com/ksteffe/after-certainty/main/books/curiosity-before-certainty/open-graph.png",
      "openGraphImagePath": "books/curiosity-before-certainty/open-graph.png",
      "bookDir": "books/curiosity-before-certainty",
      "docx": {
        "enabled": true,
        "file": "curiosity-before-certainty.docx",
        "url": "https://github.com/ksteffe/after-certainty/releases/download/latest/curiosity-before-certainty.docx"
      },
      "epub": {
        "enabled": true,
        "file": "curiosity-before-certainty.epub",
        "url": "https://github.com/ksteffe/after-certainty/releases/download/latest/curiosity-before-certainty.epub"
      },
      "pdf": {
        "enabled": true,
        "file": "curiosity-before-certainty.pdf",
        "url": "https://github.com/ksteffe/after-certainty/releases/download/latest/curiosity-before-certainty.pdf"
      }
    },
    {
      "slug": "how-meaning-moves",
      "source": "books",
      "status": "published",
      "title": "How Meaning Moves",
      "subtitle": "Signal, Compression, Restraint, and the Pace of Understanding",
      "description": "A concise tour of how meaning travels through language, systems, and relationships, and why restraint is often the difference between noise and connection.",
      "authors": [
        "Kevin Steffensen"
      ],
      "year": 2026,
      "coverImage": "https://raw.githubusercontent.com/ksteffe/after-certainty/main/books/how-meaning-moves/BookCover.png",
      "coverImagePath": "books/how-meaning-moves/BookCover.png",
      "openGraphImage": "https://raw.githubusercontent.com/ksteffe/after-certainty/main/books/how-meaning-moves/open-graph.png",
      "openGraphImagePath": "books/how-meaning-moves/open-graph.png",
      "bookDir": "books/how-meaning-moves",
      "docx": {
        "enabled": true,
        "file": "how-meaning-moves.docx",
        "url": "https://github.com/ksteffe/after-certainty/releases/download/latest/how-meaning-moves.docx"
      },
      "epub": {
        "enabled": true,
        "file": "how-meaning-moves.epub",
        "url": "https://github.com/ksteffe/after-certainty/releases/download/latest/how-meaning-moves.epub"
      },
      "pdf": {
        "enabled": true,
        "file": "how-meaning-moves.pdf",
        "url": "https://github.com/ksteffe/after-certainty/releases/download/latest/how-meaning-moves.pdf"
      }
    },
    {
      "slug": "how-serious-systems-learn",
      "source": "books",
      "status": "published",
      "title": "How Serious Systems Learn",
      "subtitle": "Disciplines for Acting Without Certainty",
      "description": "A handbook for teams and institutions that need to learn in motion, improve under pressure, and make better decisions without waiting for perfect information.",
      "authors": [
        "Kevin Steffensen"
      ],
      "year": 2026,
      "coverImage": "https://raw.githubusercontent.com/ksteffe/after-certainty/main/books/how-serious-systems-learn/book-cover.png",
      "coverImagePath": "books/how-serious-systems-learn/book-cover.png",